{
  "$schema": "https://json-schema.org/draft/2020-12/schema",
  "$id": "triage-result.schema.json",
  "title": "Triage Agent Result",
  "description": "Structured output from the triage agent, validated by the harness before the post-script runs (ADR 0022).",
  "type": "object",
  "additionalProperties": false,
  "required": ["action", "reasoning", "comment"],
  "properties": {
    "action": {
      "type": "string",
      "enum": ["insufficient", "duplicate", "sufficient", "prerequisites", "in-progress", "question", "not-planned", "completed", "split"]
    },
    "reasoning": {
      "type": "string",
      "minLength": 1
    },
    "comment": {
      "type": "string",
      "minLength": 1,
      "maxLength": 16384
    },
    "clarity_scores": {
      "$ref": "#/$defs/clarity_scores"
    },
    "duplicate_of": {
      "description": "Issue number (GitHub/GitLab integer) or Jira issue key (e.g. PROJ-123). Consumers should handle both types.",
      "anyOf": [
        { "type": "integer", "minimum": 1 },
        { "type": "string", "pattern": "^[A-Z][A-Z0-9]*-[0-9]+$" }
      ]
    },
    "triage_summary": {
      "$ref": "#/$defs/triage_summary"
    },
    "pull_requests": {
      "type": "array",
      "minItems": 1,
      "items": {
        "type": "object",
        "required": ["url"],
        "properties": {
          "url": {
            "type": "string",
            "anyOf": [
              { "pattern": "^https://github\\.com/[a-zA-Z0-9._-]+/[a-zA-Z0-9._-]+/pull/[0-9]+$" },
              { "pattern": "^https://(gitlab\\.com|gitlab\\.cee\\.redhat\\.com)(/[a-zA-Z0-9._-]+)+/-/merge_requests/[0-9]+$" }
            ]
          }
        },
        "additionalProperties": false
      }
    },
    "prerequisites": {
      "type": "object",
      "required": ["existing", "create"],
      "properties": {
        "existing": {
          "type": "array",
          "items": {
            "type": "object",
            "required": ["url"],
            "properties": {
              "url": {
                "type": "string",
                "anyOf": [
                  { "pattern": "^https://github\\.com/[a-zA-Z0-9._-]+/[a-zA-Z0-9._-]+/(issues|pull)/[0-9]+$" },
                  { "pattern": "^https://(gitlab\\.com|gitlab\\.cee\\.redhat\\.com)(/[a-zA-Z0-9._-]+)+/-/(issues|merge_requests)/[0-9]+$" },
                  { "pattern": "^https://[a-zA-Z0-9-]+\\.atlassian\\.net/browse/[A-Z][A-Z0-9]*-[0-9]+$" }
                ]
              }
            },
            "additionalProperties": false
          }
        },
        "create": {
          "type": "array",
          "items": {
            "type": "object",
            "required": ["repo", "title", "body"],
            "properties": {
              "repo": {
                "type": "string",
                "description": "GitHub/GitLab path-style identifier (org/repo) or bare Jira project key (e.g. PROJ). Consumers should handle both formats.",
                "anyOf": [
                  { "pattern": "^[a-zA-Z0-9._-]+(/[a-zA-Z0-9._-]+)+$" },
                  { "pattern": "^[A-Z][A-Z0-9]*$" }
                ]
              },
              "title": {
                "type": "string",
                "minLength": 1
              },
              "body": {
                "type": "string",
                "minLength": 1
              }
            },
            "additionalProperties": false
          }
        }
      },
      "additionalProperties": false
    },
    "sub_issues": {
      "type": "array",
      "minItems": 2,
      "items": {
        "type": "object",
        "required": ["title", "body"],
        "properties": {
          "repo": {
            "type": "string",
            "description": "GitHub/GitLab path-style identifier (org/repo) or bare Jira project key (e.g. PROJ). Consumers should handle both formats.",
            "anyOf": [
              { "pattern": "^[a-zA-Z0-9._-]+(/[a-zA-Z0-9._-]+)+$" },
              { "pattern": "^[A-Z][A-Z0-9]*$" }
            ]
          },
          "title": {
            "type": "string",
            "minLength": 1
          },
          "body": {
            "type": "string",
            "minLength": 1
          }
        },
        "additionalProperties": false
      }
    },
    "label_actions": {
      "$ref": "#/$defs/label_actions"
    },
    "component_actions": {
      "$ref": "#/$defs/component_actions"
    }
  },
  "allOf": [
    {
      "if": { "properties": { "action": { "const": "insufficient" } }, "required": ["action"] },
      "then": { "required": ["clarity_scores"] }
    },
    {
      "if": { "properties": { "action": { "const": "duplicate" } }, "required": ["action"] },
      "then": { "required": ["duplicate_of"] }
    },
    {
      "if": { "properties": { "action": { "const": "sufficient" } }, "required": ["action"] },
      "then": { "required": ["clarity_scores", "triage_summary"] }
    },
    {
      "if": { "properties": { "action": { "const": "in-progress" } }, "required": ["action"] },
      "then": { "required": ["pull_requests"] }
    },
    {
      "if": { "properties": { "action": { "const": "prerequisites" } }, "required": ["action"] },
      "then": {
        "required": ["prerequisites"],
        "properties": {
          "prerequisites": {
            "anyOf": [
              { "properties": { "existing": { "minItems": 1 } } },
              { "properties": { "create": { "minItems": 1 } } }
            ]
          }
        }
      }
    },
    {
      "if": { "properties": { "action": { "const": "split" } }, "required": ["action"] },
      "then": { "required": ["sub_issues"] }
    }
  ],
  "$defs": {
    "clarity_scores": {
      "type": "object",
      "required": ["symptom", "cause", "reproduction", "impact", "overall"],
      "properties": {
        "symptom": { "type": "number", "minimum": 0, "maximum": 1 },
        "cause": { "type": "number", "minimum": 0, "maximum": 1 },
        "reproduction": { "type": "number", "minimum": 0, "maximum": 1 },
        "impact": { "type": "number", "minimum": 0, "maximum": 1 },
        "overall": { "type": "number", "minimum": 0, "maximum": 1 }
      },
      "additionalProperties": false
    },
    "triage_summary": {
      "type": "object",
      "required": ["title", "severity", "category", "problem", "root_cause_hypothesis",
                    "reproduction_steps", "impact", "recommended_fix", "proposed_test_case"],
      "properties": {
        "title": { "type": "string", "minLength": 1 },
        "severity": { "type": "string", "enum": ["critical", "high", "medium", "low"] },
        "category": { "type": "string", "enum": ["bug", "performance", "security", "documentation", "feature", "other"] },
        "problem": { "type": "string", "minLength": 1 },
        "root_cause_hypothesis": { "type": "string", "minLength": 1 },
        "reproduction_steps": { "type": "array", "items": { "type": "string" }, "minItems": 1 },
        "environment": { "type": "string" },
        "impact": { "type": "string", "minLength": 1 },
        "recommended_fix": { "type": "string", "minLength": 1 },
        "proposed_test_case": { "type": "string", "minLength": 1 },
        "block_auto_promotion": {
          "description": "Set blocked to true with a reason to prevent auto-promotion; set blocked to false with a reason when auto-promotion is safe.",
          "type": "object",
          "required": ["blocked", "reason"],
          "properties": {
            "blocked": { "type": "boolean" },
            "reason": { "type": "string", "minLength": 1, "maxLength": 1024 }
          },
          "additionalProperties": false
        }
      },
      "additionalProperties": false
    },
    "label_actions": {
      "type": "object",
      "required": ["reason", "actions"],
      "properties": {
        "reason": {
          "type": "string",
          "minLength": 1,
          "description": "Single sentence explaining why these labels are being applied or removed"
        },
        "actions": {
          "type": "array",
          "minItems": 1,
          "maxItems": 20,
          "items": {
            "type": "object",
            "required": ["action", "label"],
            "properties": {
              "action": { "type": "string", "enum": ["add", "remove"] },
              "label": { "type": "string", "minLength": 1, "pattern": "^[a-zA-Z0-9._/: +-]+$" }
            },
            "additionalProperties": false
          }
        }
      },
      "additionalProperties": false
    },
    "component_actions": {
      "type": "object",
      "required": ["reason", "actions"],
      "properties": {
        "reason": {
          "type": "string",
          "minLength": 1,
          "description": "Single sentence explaining why these components are being assigned or removed"
        },
        "actions": {
          "type": "array",
          "minItems": 1,
          "maxItems": 20,
          "items": {
            "type": "object",
            "required": ["action", "component"],
            "properties": {
              "action": { "type": "string", "enum": ["add", "remove"] },
              "component": { "type": "string", "minLength": 1, "pattern": "^[a-zA-Z0-9 _./:+()&,'-]+$" }
            },
            "additionalProperties": false
          }
        }
      },
      "additionalProperties": false
    }
  }
}
